{
  "runtime": "command",
  "name": "systemspec-c",
  "version": "0.0.0",
  "author": "EZyapper",
  "description": "C implementation of system specification tool",
  "priority": 10,
  "tools": [
    {
      "name": "get_system_spec",
      "description": "Get CPU model, thread count, max frequency, and total memory",
      "parameters": {
        "type": "object",
        "properties": {}
      },
      "command": "./systemspec-c",
      "args": ["get_system_spec"]
    }
  ]
}
