{
  "runtime": "command",
  "name": "datetime-zig",
  "version": "0.0.0",
  "author": "EZyapper",
  "description": "Zig implementation of current datetime tool",
  "priority": 10,
  "tools": [
    {
      "name": "get_current_datetime",
      "description": "Get the current date and time",
      "parameters": {
        "type": "object",
        "properties": {}
      },
      "command": "./datetime-zig",
      "args": ["get_current_datetime"]
    }
  ]
}
